"txt","offensive"
">>59497você é completamente retardado.sua pitanga é bissexual, e você se sente incomodado com isso. qual seu problema?>nesses tempos malucosnão. grande parte das mulheres são bissexuais, inclusive até as que não são já transaram a 3 com outra mulher. e isso não é exclusivo dessa época. reis e pessoas do alto clero sempre transaram com várias ao mesmo tempo.>ela não vai fazer a 3 comigo pois tem ciúmes.não. ela te considera beta, e por isso não irá fazer a 3.","1"
"bom dia era tudo oq eu precisava agora 😔😔😔💞","0"
"@mariturquesv velha velha e nem se manca","0"
">>60244>em uma das vezes chegou a tirar ""sarro"" do tamanho do meu pauoh wow, para mim isso já seria cartão vermelho. não sei como vocês aguentam esses relacionamentos abusivos.","1"
"Quer chamar atenção do marido organiza um grupal com as amigas pra ele, jumenta https://t.co/sHHSV1hg7a","1"
"churrasco e cerveja gelada, quero mais nada pra hoje","0"
"acho que meu curious cat tá errado, pq pergunta não tem mas gente me xingando ou enchendo o saco tá cheio kkk","0"
"@carol_moura13 @RitaBranco02 opa, que fufas tratem se","0"
">>27317>secessão>2018boa sorte se livrando da negrada, metade da comunidade internacional vai te bombardear à merda se tentar algo do tipo","1"
"isso sim é meta, crescer e ainda ajudar a pessoa que você ama a crescer junto!!! 💏 ","0"
">>60498então pra que passar vergonha e admitir que não tem argumentos?>>60499%c3%aancia_aned%c3%b3tica","1"
"anões, algum de vocês utiliza o coito interrompido como método anticoncepcional? funciona?","1"
"RT @CapitalismoOP: #SerMulherÉ ter cromossomos xx e não ter uma rola no meio das pernas","1"
"meus caros, vejo vocês falando de tadalafila, qual o preço médio desta porra? vou transar esse fim de semana com uma vagabunda deliciosa e preciso performar bem, porém não sei o preço e preciso ir preparado pra farmácia, já que não tenho dinheiro sobrando pra pagar independentemente do preço.","1"
">>60213quando o fio pinado sobre o foguinho foi deletado, o moderador disse que as discussões teriam que ser feitas neste fio a partir de em diante.","1"
"Veja as fotos e o vídeo. Islão, aqui, não! https://t.co/rnj2MV3chu#RenovarPortugal #PNR #Islão #Muçulmanos #Mesquitas #Portugal","1"
"as vezes eu tenho a impressão de q a questão q eu faço dos outros, eles não fariam de mim, pq isso?","0"
"pergunte-me qualquer coisa ","0"
">>54598é simples, anão, trabalhe, mude de vida e então viva a vida como um rei. até lá, coma o que tiver, viva com o que puder.estar mal não é motivo para se desanimar, pior seria não ter coragem de tentar sair da merda, aí sim é motivo para se martirizar.","1"
"RT @PastorMalafaia: FELIPE NETO é uma honra ser caluniado por um INESCRUPULOSO como você.Vou lhe dar a chance, na justiça, para você provar _","0"
"green te viu, gleen te vê ? rt","0"
"anão que já usou tadalafila mais de 100 vezes. estarei respondendo toda e qualquer tipo de dúvida a respeito do medicamento. posso dizer, com toda certeza, que o conheço mais do que os criadores do mesmo.se você tem problemas com ereção, tire todas suas dúvidas.","1"
"@fvicentedasilva os avençados tinham agenda ou carteira?...","0"
"RT @newdoppelganger: @Estadao que legal esse proselitismo barato sobre muçulmanas. Vamos falar sobre mutilação vaginal também? Falta de dir _","0"
"permita-me dizer a vocês, anões jovens, o que muito provavelmente vai acontecer com sua vida caso você não se torne um normalfag, e posso adiantar pra vocês com precisão: os paus no meu cu ruins e natureza depressiva que vocês estão sentindo agora, nesse momento da vida de vocês, vão ser um grãozinho de areia comparado a o que está por vir.18~20: é nesse momento que o ensino médio acaba e você se sente um pouco livre, embora perdido como a fornicação. esse pau no meu cu de estar perdido é bastante normal nessa idade, já que é o tempo que você precisa pra se encontrar na vida, se quer fazer uma faculdade, ir logo trabalhar… ao menos é isso que sua família diz. não se enganem: enquanto vocês ficam parados em casa ou achando que só ir pra faculdade vai resolver algo, pode ter absoluta certeza que os normalfags não aguentam ficar parados em casa. eles estão procurando emprego, fazendo atividades extras, trabalhando em subempregos, fazendo contatos, a merda que for. diferente de você, eles estão se mexendo, fazendo alguma coisa, enquanto você, anão, está em casa, batendo punheta, merdapostando no chan e jogando videogame.21~23: nesse momento, assim como dos 18 aos 20, ainda existem muitos neets, talvez alguns de vocês tentaram alguma faculdade e não gostaram e saiam ou estão empurrando com a barriga, talvez você tenha arranjado seu primeiro emprego mas foi demitido ou não está conseguindo lidar bem com ele por ser muito autista. todo os normalfags nesse momento estão se formando na faculdade ou perto de se formar, alguns estão prosperando no seus empregos,ganhando seus salários mensalmente e construindo suas vidas. mas o anão padrão, nesse momento, muito provavelmente ainda não moveu um dedo se comparado com o normalfag padrão, ele percebe a própria estagnação e entra em pânico. seus pais começam a ficar preocupados, mas eles ainda estão achando que você, mesmo que tarde, ainda pode 'virar gente', mesmo com a sua alarmante falta de prepado e experiência, e principalmente, a falta de contato humano genuíno.24~26: como que todo mundo de uma hora pra outra está se casando/tendo filhos? o meme ""tfw no gf"" agora perde completamente seu significado, já que nessa idade as ninguém quer saber de namorinho, depósitos de porra procuram algo mais sério e você ainda continua com pouca ou nenhuma experiência nesse quesito. nesse momento, se você ainda não conseguiu um emprego decente ou ainda vive como um neet, pode ter absoluta certeza que muito provavelmente você vai passar o resto da sua vida trabalhando em subemprego caso você seja de classe c pra baixo e caso não passe em um bom concurso. seus pais agora perderam completamente a esperança em você e quando eles estão dentro de casa com você por perto sempre acontece aquele silêncio constrangedor, brigas e acusações são constantes, você já não aguenta mais seus pais, porém, não tem o dinheiro/experiência pra morar sozinho, sua vida vira um caos completo, você inclusive perde a atração/prazer em hobbies antigos.27~29: nesse momento, sua família tolera sua presença assim como tolera a presença de uma barata. eles te odeiam e perderam toda a esperança que tinham em você. uma década de confinamento solitário deteriorou sua memória, sua mente, seu físico, e você provavelmente desenvolveu algum problema de saúde por sentar sua bunda numa cadeira o dia inteiro ou ficar deitado o dia inteiro. você começa a regretar muitas coisas e vive com um pau no meu cu de culpa imenso. provavelmente vive a base de álcool ou remédios controlados pra aliviar a dor. nesse ponto, você nem ao menos se importa mais em arranjar uma pitanga ou até mesmo um emprego. vez ou outra você recebe uma dose de esperança que sua vida irá mudar algum dia, mas ela logo passa.30+: escuridão e caos.é isso, anões. não irei contar sobre mim porque iria ficar gigante e ninguém iria ler, mas minha vida atualmente é um inferno na terra e não desejo essa vida nem pro meu pior inimigo… espero que isso sirva de alerta pra vocês, a vida é dura e cobra uma hora ou outra, se vocês não consertarem a vida de vocês agora, vocês estarão fodidos igual a mim no futuro, eu não vejo a hora de criar coragem pra me matar. estou deixando o chan pra sempre e me senti na obrigação de criar esse post. adeus e desejo o melhor pra vocês, saiam desse site e vão fazer algo da vida enquanto há tempo. se você não suporta o quejim minas, ao menos tente funcionar dentro dessa sociedade de bosta, é melhor do que se sentir culpado o tempo inteiro e regretar cada segundo de sua vida pro resto da vida.","1"
"Calma sportinguistas, já podem respirar de alívio.
O Benfica ganhou ao Braga.
O vosso 3º lugar está quase garantido","0"
">>56502voltei do encontro. combinamos que íamos nos encontrar em um café e depois fomos beber uma cerveja. foi bem divertido, gostei dela, conversamos sobre vários assuntos, principalmente sobre psicologia, no final nós ficamos. o mais estranho é que eu contei pra outra guria que eu tinha saído pra beber e ela ficou meio putinha, pressionei e ela disse que estava estranha porque o ex dela dizia que ia pra faculdade mas ia beber, kek. não vou abrir o jogo falando que eu saí com uma guria, pelo que eu me lembre, a teoria dos pratos diz justamente isso estou meio bêbado também pra lembrar.enfim, já estou tentando escalar ir na casa dessa aí, ela mora sozinha, espero poder confirmar tudo que o livro diz, vou tentar botar tudo em prática.amanhã eu vou em uma balada com essa depósito que eu estou ficando há alguns meses e provavelmente ela irá pra minha casa. enfim, só relatando a minha jornada de matar o beta interior, se quiserem eu paro.","1"
"se continuar assim, homofóbicos não vão mais beber, nem se vestir, nem jogar ! ♥️🌈 ","0"
"sera se vocês podem manter esse video pra sempre na minha tl? por favor, obrigada 

","0"
"anões que estudam ou trabalham, vocês conseguem/conseguiram ""burlar"" o brain fog nas primeiras semanas? essa merda está atrapalhando muito meu raciocínio e fico com menos motivação ainda pra estudar, somando ao problema com os sensores dessensibilizados de dopamina. nisso, sou induzido a me voltar à pornografia, já que, em alguns dias, não consigo fazer nada bem além de vagabundar e lurkar no chan.o peculiar é que o brain fog e a motivação parecem ser muito inconsistentes no meu nofap/noporn. num dia, sou mais burro e desmotivado que uma porta; no outro, depois de uma certa hora, meio que volto a um estado de ""quase-normalidade"". no próximo o brain fog volta. talvez não estou sabendo diagnosticar bem, ou só estou fazendo alguma coisa que afaste o brain fog, mas que não sei ao certo.enfim, como os senhores lidam com os problemas de raciocínio e de desmotivação?","1"
">>30192>vadia esquarteja o próprio filho junto com a machona>culpa o pai pela alienação parental >premedita o crime>pega em flagrantekek. merdalher é mesmo lixo puro.","1"
"odeio admitir, mas não há mais sentido em casar. a maioria das mulheres estão contaminadas pelo feminismo e degeneração. não atoa mais de 50% dos casamentos terminam em divórcios.o desenvolvimento pessoal e o individualismo é são a única saída para o homem. casar é para quem quer ser corno e perder a sanidade mental.","1"
"Flamengo x Lanús no Equador. Boa ideia! https://t.co/a8FQ3vCPTk","0"
"meu feriado tá mortinho","0"
"@r1quers coragem viu","0"
"@mariavitoriacr @natzinha092 olha a sobrancelha arqueada com botox que maravilhoso, queria a minha assim","0"
"@maayspfc quando o #spfc jogar tem q colocar os refletores em destaque pra torcida o nosso único orgulho dos últimos anos, para o campo se acender uma vela iluminando eles já está bom pra eles.","0"
"aí os torcedores do barcelona morrem","0"
"RT @ly_carr: Toda vez que vejo homem comentando que toda feminista é sapatão tenho vontade de gritar no ouvido dele QUEM DERA","0"
">>36226relatando novamente.sobre produtividade e essas merdas de ficar melhor em algumas coisas e tal, pura balela. não mudou nada pra mim.qualquer mulher com uma blusa ou saia mais curta já faz meu pau ficar duro. está dificíl.","1"
"@BarbraStreisand A kiss from Brazil (um beijo da galera aqui) https://t.co/aIaxz3fB4K","0"
"eu amo demais esse garoto louis tomlinson obrigada pelos mimos james","0"
">>30092simplesmente perfeito. quando eu tiver algum tempo livre e saco, vou começar a escrever textos lacradores para defender as aberrações.estarei esperando a merda pegar real para lançar cada um deles na internet à fora.vamos ver quem tem mais criatividade para fazer textos lacradores. aposto que os anões são muito melhores que as vagabundas e os soyboys do dce:vocês estão tentando justificar suas falhas a partir do preconceito. já pararam para pensar que atrás de cada atleta trans há uma guerreira que se esforçou ao máximo e enfrentou cada tipo de adversidade para chegar onde chegou?treinem mais, se esforcem mais e aprendam a conviver com as adversidades. nos esportes há lugares para todos e qualquer tipo de preconceito jamais deverá ser tolerado.o que uma mulher precisa fazer para ser considerada mulher? seguir os padrões de beleza irreais? ter a genitália ""correta""? ganhar menos que um homem? quem sabe a solução seja chegar sempre em 8º lugar. o machismo mais perturbador, é aquele cometido pelas próprias depósitos de porra.então por que não separamos os teutões no atletismo? por que não separamos os chineses na ginástica? por que não separamos os coreanos nos e-sports? é inacreditável que em pleno século 21 ainda somos obrigados a conviver com esse tipo de preconceito. para piorar tudo, as autoras desse ódio seletivo são mulheres, esquecendo completamente o sofrimento e a dificuldade que enfrentaram para chegar onde chegaram na nossa sociedade.","1"
"abri a janela tava uma gorda no apartamento da frente olhando pra baixo e chorando, acho que caiu a empadinha dela","1"
">>59630tente usar fantasias e chegar nas piranhas fazendo alguma graça. normalmente não precisa nem dizer nada, olhe para ela e se ela olhar de volta se aproxime e já puxe pela cintura.","1"
">>60594anãozinho, escute o que um oldfag casado, com dois filhos e 37 anos nas costas tem pra dizer escute com atenção. em um, dois anos no máximo você não terá contato com essas bocetas. serão só memórias. e com o passar do tempo, perceberá que o melhor investimento nessa vida é a estabilidade financeira e a memória de muitas e boas fodas com uma variedade de vadias. depois sua energia vai diminuir um pouco e buscarás uma estabilidade de relacionamentos. portanto, aos 22 anos, o seu objetivo é se ganhar ou se preparar para ganhar dinheiro e foder vadias. me escute: não namore, não engravide ninguém. coma as 3. se puder, sugira um menage, coma cus, goze na cara, dê tapas, meta o loco. depois conquiste outras e repita o processo ad nauseam.","1"
"depois q descobri minha paixão por gloss nunca mas quis usar batom .. ","0"
">>52416>>52416qualquer farmácia tem, vai falar que tem medo de comprar? qualquer coisa é só falar que é para um amigo seu, só que ele é tímido e tem dinheiro.","1"
"trouxe uma mulher para fornicar em casa, à noite, mas sem apresentar pra minha mãe. quando cheguei, apenas avisei e fui com a garota para o meu quarto. no dia seguinte, ouvi um esporro sem precedentes, com ela dizendo que deveria ter apresentado antes, que aqui em casa não é bagunça, etc. eu compreendo a casa é dela, mas porra, será que ela não compreende!? por que ela não me deixa ser homem uma vez na vida?detalhe: moramos somente eu, ela e minha irmã.puta que pariu, /b/. na primeira vez que consegui fornicar de maneira casual, como um ""homem alfa"", experimentar a sensação de ter uma mulher sedenta, sem mil burocracias, sexo sem compromisso e de forma rápida, levo uma rasteira que me fez ficar pior do que estava antes. quando acho que estou deixando a falha, ela volta com 10x mais força. que merda.vontade de sumir.","1"
">>28848sai daqui, seu filho da puta do caralho! volte para suas redes sociais de merda, arrombado!","1"
"*jimin dançando sensualmente e sendo o homem mais gostoso do mundo*

jimin 5 segundos depois:
 ","0"
"🍯- indicando filmes da disney🍯 ","0"
"sabe aqueles lava-jatos irregulares na favela do metrô perto do maracanã? aquela galera que a prefeitura fez de tudo para tirar dali. tentou remover e multar os carros que parassem para usar o serviço. nada dava resultado. eles voltavam no dia seguinte. passei lá agora ","0"
"@gabrielcozendey oq vocês fizeram sem mim? :(","0"
"RT @reaconaria: Para a mídia o argumento que vale é 'se eu não gosto, então é Hitler'
https://t.co/Z5qbBxwYVA","0"
">18 anos>moro no interior do acre>pobre, moro em casa de madeira>sem ensino médio>sem emprego>passei arrastado no ensino fundamental>pai que não dá uma dose>mãe grelo duronão consigo ver um futuro para um cara tão ignorante como eu. eu gostaria de fugir, mas fugir para onde? não tenho lugar para ir, dinheiro e nem conhecimento. anons, me iluminem, há alguma chance de eu me dar bem se fugir assim? sempre pensei em me matar, mas eu só pensava, hoje em dia tudo está pior, tudo está pior, o castração não é mais pensado, mas sim cogitado. anons, vou tomar todos os remédios que tenho aqui qualquer dia desses, poderiam me informar qual seria a pior das hipóteses?por favor, não me sugiram coisas óbvias, pois obviamente eu já tentei ou pensei.","1"
">>62933estou em uma situação parecida com a sua, com duas diferenças: a minha é mais pucta que a sua (já fez menáge e escambau) e eu era bvirgem até conhecer ela.dois sérios agravantes, não?o que a gente sente é uma cornice retroativa. é pensar que ela já deve ter visitado tal lugar com outro cara, feito tal coisa com algum outro, falado as mesmas coisas que ela fala pra você pra tantos outros antes. é ver algum desconhecido cumprimentar vocês e pensar: ""ela já deve ter dado pra esse cara"", fingir um sorriso e cumprimentar de volta.largar ela talvez não seja solução. é possível, além de ser corno retroativo, ser um pré-corno. pare e pense por um segundo: a sua futura namorada provavelmente está transando com o atual ficante/namorado dela neste exato momento. isso se ela não tiver girando em cinco rolas nababescas ao mesmo tempo, sendo mais vadia que a sua atual jamais foi. e talvez você nunca saiba. ninguém está limpo nesse mundo.e se acontecesse de você realmente acabar pegando alguém inexperiente, essa pessoa provavelmente teria curiosidade em saber como é estar com alguém além de você. você trocaria o ciúme passado por um certo ciúme presente. não há escapatória.não há escapatória pois o problema não está na vadiagem das vadias, mas sim na nossa própria insegurança.o caso é que não faz o menor sentido competir com quem já perdeu. se ela quisesse estar dando pra qualquer um dos outros caras que não você, ela com certeza estaria. mas por algum motivo você está levando a preferência. você está ganhando de alguma forma.não tenho soluções ou conselhos pra dar, mas quero fazer duas perguntas: ela vale a pena o preço que você está pagando?você tem fé?se sim pras duas, amigo, apenas siga o teu destino. é muito fácil ficar pensando ""se x fosse diferente, as coisas seriam melhor"", mas a verdade é que talvez, só talvez, elas realmente não fossem. existem muitas coisas que estão fora do nosso controle. talvez você já esteja na sua melhor timeline.","1"
"RT @Arigfeijo: Ver homossexuais, não faz ninguém homossexual. Assim, as crianças não ficam preconceituosas e vão respeitar a orientação sex _","0"
"se você precisa lembrar de alguém de quem você não consegue refutar uma só linha p/ não se sentir um merda, é sinal _ https://t.co/GfIK7knI5N","1"
"@anapntes @valehomossexual então achar gorda feia é falta de autoestima? Ataaaa","1"
"RT @oautentico3: Lamarca foi tentar correr atrás do #blocosovietico, não teve pique pra acompanhar e 'morreu' no meio do caminho https://t. _","1"
">>63608>>63609nunca tinha reparado nela, mas na sexta à noite vi ela na faculdade. parece mais gorda do que nas picas, o formato do rosto dela também não me agrada. mas, é aquilo, se fosse para meter em um dia qualquer, iria. não quero que meus amigos saibam que eu estou de papinho com a gordinha, simplesmente não acho legal, a real é que eu tenho vergonha dela. enfiar meu pau ali, entre quatro paredes, ok. agora ficar de papinho, sorriso forçado e cumprimentos, acho desgostante. jamais faria isso independente do meu nível de carência.","1"
">>59170sou manlet, mas não o quotado. posso confirmar que ser mais alto que as depósitos é um pré-requisito para mais de 90% da população feminina querer transar com você.infelizmente as piores falhas são impossíveis de serem consertadas. a idade para tomar gh já passou. uso aquelas palmilhas mas mesmo assim é muito artificial e a cirurgia além de cara não é feita por nenhuma clínica no brasil. aos demais anões, busquem resolver suas inseguranças, seja com cirurgias, puxando ferro ou até com auto ajuda. mesmo que as depósitos não venham, muitos sonham com uma sensação boa de se sentir atraente e em casos como o da altura isso não tem solução.","1"
"@ibrags isso é doideira. Os sírios-libaneses quando vieram pra cá não receberam 1% das benesses desses refugiados, mas agradeciam","1"
">>59112hack é uma merda. e se você está fazendo abdutora, por que não faz adutora também?","1"
"Uma vez qdo era criança  eu tava no drive do Mc e um garoto pediu um lanche
Meu pai disse: Não não, se não depois vc não almoça!","0"
"RT @rpsantos1970: Já nada nos pára! Estamos juntos! @PNR 
#Portugal #RenovarPortugal https://t.co/9JCCA3QpwZ","0"
">>57283tenho essa dúvida.>>57291vá malhar. você está com déficit de massa muscular.","1"
"como deixar de ser um average guy? puta que pariu, eu não sei fazer nada, não tenho habilidade para nada, não tenho nenhum hobbie.nem sei porque estou vivendo.nem lutar na legião estrangeira eu posso por ter o joelho fodido. o conceito de homem beta faz todo o sentido, é um cara mediano que não agrega valor nenhum. não quero morrer assim, puta que pariu!","1"
"meu cabelo tá maravilho hj e em função disso eu to me sentindo maravilhosa também 

dias d glória","0"
"temos algum anão gago aqui? eu lido com isso a minha vida inteira, e todo dia eu penso em desistir de tudo. como que eu não consigo fazer uma coisa tão básica que é se comunicar?eu não consigo nem pedir informações ou pedir algo em um restaurante sem gaguejar. é horrível ficar com a boca aberta esperando sair algum som, as pessoas valorizam menos a tua opinião e não preciso nem falar que você não tem autoridade nenhuma, pessoas rindo de você e imitando você falando. eu não aguento mais, anões, eu só queria que isso tivesse um fim.","1"
"meu amigo quer te pegar — bum né ","0"
"@luccasalvim @mcbretas sem polícia sem vandalismo!?","0"
"@itsmabizao Tem q ser muito capacho de ideologia para apoiar uma cultura q apedreja e açoita mulheres só porque a e _ https://t.co/TXnzhtq7at","1"
"vsf eu","0"
">>59180>quer apresentar o chan para namoradinha>frequenta o /magali/você é o câncer que mata o chan e envergonha essa tábua.","1"
"RT @ativismodesofa: #EuParo pq feminicídios ainda são noticiados com chamadas que dizem 'por amor', 'por ciúme' ou 'crime passional'. O cer _","0"
"cara eu acordei pra ser socada na cara","0"
