"txt","offensive"
"dançar é prazeroso pra mim? definitivamente não. não me sinto nada a vontade em ficar requebrando as cadeiras na frente de um bando de estranhos, dexcolados ou não.mas pela puta que o pariu, anão, você inventou uma mentira sobre si para posar de dançarino, agora você tem basicamente três opções, veja com racionalidade:1 - você conta a verdade, a versão correta da sua vida, na qual vc não sabe nada sobre requebrar o popozão, ou pelo menos odeia essa merda.2 - você some do mapa, desaparece do radar da sua fruta e nunca mais dá as caras.3 - você cria coragem, vira homem pela primeira vez na sua vida e sai pra dançar com sua fruta, afinal, vc já falou que não leva jeito e ela não estará esperando nada especial de você.vamos esquecer por um breve momento sua falha e refletir um pouco sobre essa última abordagem: o que de pior pode te acontecer se sair para remexer essa bunda seca com sua pitanga? você pode morrer? você pode ficar tetraplégico? você pode falir financeiramente e virar um pedinte sujo? não anão, nada disso. veja que o pior que pode te acontecer é sua pitanga descobrir que vc não dança porra nenhuma, coisa que ela já deve saber, sua anta ansiosa.entenda de uma vez, querido anão, a maior probabilidade é de que sua pitanga não espera que você seja um carlinhos de jesus, mas ela te chamou pra dançar para se exibir pra ti, não vê a hora de rebolar majestosamente aquela bunda marota no seu bene fazendo carinha de safada te olhando nos olhos, ""olha, anão, como sou sexy, queria te mostrar a tanto tempo…"", sua performance pouco importará, desde que você esteja a vontade com ela e com você mesmo.vire homem, filho da puta, é a sua chance de criar coragem e ver que o mundo está se lixando para o que você faz ou deixa de fazer.","1"
"não precisa ter assunto. só fala comigo.","0"
"RT @hgbotelho_: @_iglira bom dia macaco branco haha","0"
"sobre desistir de relacionamentos.tenho 23 anos e só namorei uma vez. foi de março de 2017 até abril do ano passado. um verdadeiro inferno. tirando algumas poucas coisas boas aqui e ali, a relação foi uma total merda. era fodendo estresse o tempo todo, ela era explosiva e, por ser meu primeiro namoro, não sabia lidar com isso. não há como realmente expressar o quão estressante foi pra mim, então, resumirei assim: no meio do estresse todo, acabei perdendo 5kg. sim, pois é.vez por outra eu dou uma olhada no fio ""manual da pitanga"" e é foda como eu vejo anões estressados, cheio de problemas em seus relacionamentos. então, me pergunto: será que estar em um relacionamento, ter alguém, deveria mesmo ser visto como algo melhor do que estar sozinho?não só aqui no chan, mas vejo casos irl de caras estressados com seus relacionamentos, pelo mais diversos motivos: medo de ser pai, ciúmes, insegurança, etc, etc, etc. a lista é grande.sabe, dia desses eu estava com minha família no shopping. no meio do pessoal, estava a namorada do meu primo. caras, do fodendo nada, ela ficou com uma cara de cu e aborrecida. a depósito estava ótima e rindo e do nada mudou de comportamento. meu primo, com toda razão, ficou puto e perguntou o que tinha acontecido. ela, pra deixá-lo mais louco ainda, manda um ""nada"". então tive que ver meu primo tentar descobrir o que fez sua pitanga ficar aborrecida. sinceramente, eu me senti feliz por não estar naquela situação. imagina, estar se divertindo com a família no shopping e, minutos depois, ter que ser psicólogo de depósito? isso é uma merda, anões. é uma merda, e eu sei como é, pois, eu vivi isso.enfim, minha dúvida é: será que precisamos tanto assim de alguém? no começo é tudo perfeitinho, mas depois vem o inferno. alguém aqui vive um relacionamento muito bom, com poucos problemas? se sim, por favor, respondam essa thread. não estou dizendo que nunca mais devemos namorar, mas, sabe, eu não entendo pessoas que acham horrível estarem sozinhas e que sentem uma puta necessidade de estarem em um relacionamento.será que meu único e primeiro namoro foi algo tão traumático e agora não consigo ver uma vida à dois de outra forma?","1"
"Ao mestre com carinho...Luiz Carlos Alborghetti (12/02/1945-9/12/2009): jornalista, radialista com culhões e @homemdeverdade R.I.P.!","0"
"olá anões, venho perguntar sobre uma coisa que tem me incomodado demais nos últimos anos, digo sobre motivação pra viver.estou no 3º ano do ensino médio, um momento deveras crítico para ter uma dúvida assim, o que tá acabando com minha cabeça. indo direto ao ponto, não tenho um objetivo claro no qual colocaria esforço para alcançar.a história mudaria se eu tivesse um sonho como um lugar que quisesse ir, mas mesmo que tivesse, não é isso que me incomoda mais. o que tenho mais medo é que em certo ponto, observar minha vida, e achar que ela não teve sentido nenhum. claro que é possível que eu morra antes disso, mas isso não muda nada. eu já desperdicei minha infância, não quero desperdiçar o resto da minha vida também. não sou capaz de escolher o que vou fazer com minha vida sem pensar o que essa escolha vai significar pra mim no final. sendo assim chegamos a várias perspectivas, do sentido da vida em si: viver para ser lembrado; viver para contribuir para com o mundo ou humanidade; viver para acumular bens, capital, conquistas ou memórias; viver para mudar o mundo, as pessoas, sua descendência, país; ou qualquer outra coisa. o que realmente importa no final? gostaria de saber o que vocês acham a respeito disso.a propósito, tendo a acreditar que o que vale a pena é criar memórias, já que é só isso que literalmente vamos nos lembrar.","1"
"medicação: cloridrato de sertralinatempo de uso: 2 semanasefeitos: melhora um pouco a ansiedade e o toc,dá uma diminuição grande no libido.comecei a tomar pois achei que tinha engravidado uma menina,embora todos os fatores levariam uma pessoa normal a pensar que já tinha acabado e não tinha acontecido nada (ela tomava anticoncepcional,tomou pds e a menstruação ainda desceu) na minha cabeça parece ter havido um trauma de ansiedade que se estende até agora.comecei a ter medo de viver,com crises de pânico e ansiedade (remédio controla um pouco)","1"
"Falou 'populista' já sei que é da turma 'fake news' e RETARDADO! https://t.co/Dr87lJ0zBg","0"
"os cara fica bravo de mais kkkkkkkkkkkkkkkkkkkkkkkkkkkkkk","0"
"Esse cara é um lixo humano, é daqueles imbecis que acham que sabem tudo https://t.co/Ocs4E9fEV1","1"
"RT @dexmagazine: Presidente da África do Sul pede confisco de terras de pessoas brancas | https://t.co/QruyRMyl8Ahttps://t.co/DOAZeHnpA4","0"
">>28168>primeiro, esse termo (propriearanos) é completamente retardado e eu nem ao menos consegui descobrir que merda isso implica; não há uma entrada dele na internet e nem mesmo vi em seu provável equivalente em inglês>no mais, é certo que nenhum tradicionalista católico quer acabar com o estado, só faz sentido dizer isso se você aplicar uma leitura marxista do que é o estadoa igreja, quando usa o termo ""estado"" termo no seu magistério social (que tem por principal elemento fundador a lei natural, e que deriva da teologia moral, tal como diz miguel ayuso torres) quer dizer ""comunidade política baixo certa autoridade (você pode conferir isto em miguel ayuso torres, danilo castellano, juan fernando segovia, javier barraycoa martínez e outros), assim, o estado é natural, tem uma origem natural enquanto é a sociedade civil (ou comunidade política, que como mostram josé pedro galvão de sousa, juan fernando segovia e outros, são sinônimos) e possui uma autoridade naturalmente constituída, permitida pela providência de deus (ver luigi taparelli d'azeglio).assim, o estado, se segue os quesitos para a legitimidade (ver miguel ayuso, francisco elías de tejada, juan vallet de goytisolo e danilo castellano) é um instrumento e ministro de deus para o governo temporal dos homens (são pedro, são paulo, francisco de vitória, francisco suárez etc), claro que tal estado não pode ser soberano (danilo castellano) e deve ser subordinado à igreja (cardeal alfredo ottaviani, cardeal louis billot) e tal subordinação deve ser essencial (pe. álvaro calderón).porém,tratando de libertarianismo, presumo que usamos o termo equívoco (no sentido de santo tomás de aquino) ""estado"" (segundo dalmacio negro pavón, usar o termo ""estado"" mostraria que a igreja não teria entendido o estado) no sentido libertário, a saber, o de hans-hermann hoppe (o que é legítimo, uma vez que o termo correto seria ""cidade"" ou ""pólis"", ver carlos nougué) (ver também miguel ayuso, danilo castellano, juan fernando segovia, francisco elías de tejada, rafael gambra ciudad, juan b. vallet de goytisolo e outros sobre a diferença entre a ""comunidade política"" natural e o ""estado"" artificial).segundo a definição de hoppe, o estado é um monopolista territorial compulsório da jurisdição (pensadores católicos usam definições semelhantes e também fazem críticas ao estado, vide danilo castellano, augusto del noce, roberto de mattei, francesco gentile, miguel ayuso, rafael gambra, juan fernando segovia, julio alvear téllez, juan vallet de goytisolo, josé pedro galvão de sousa etc), ou seja, o estado é uma agência (um artefato, artifício, máquina, aparato técnico) que reclama de modo compulsório, por vezes violento (miguel ayuso), o monopólio territorial da soberania, da jurisdição (ou seja, da tomada final de decisão em todo e qualquer conflito em seu território, inclusive os que o envolvam, obtendo o monopólio da legitimação, sendo inclusive fonte da própria legitimidade), da legislação (criação de leis) e da tributação (rothbard, hoppe, oppeiheimer, negro pavón), assim, o estado (já estado ético ou moral, tal como proposto por hegel ou rousseau, e consequência da proposta de espinoza) se torna o primeiro e único critério na definição do legítimo e do ilegítimo, do certo e do errado, do bem e do mal (ayuso torres), encarnando o voluntarismo (castellano, franesco gentile) e portanto, o luciferianismo-satanismo, sendo claramente um artefato idolátrico (que se põe no lugar de deus, ver ayuso, barraycoa e negro pavón) e satânico (javier barraycoa e, salvo engano, francisco canals vidal).logo, o tradicionalismo católico está intimamente ligado ao anti-estatismo.","1"
"eu estou definitivamente assustado. lembro muito bem do meu pau na marca dos 17 cm, mas recentemente fui ver, mesmo duro, ele tava só nos 15 cm.isso muito provavelmente tem a ver com a frequencia que eu fapo, junto ao fato de eu estar tomando zoloft agora. só quero saber mesmo, como eu reverto isso? quero meu pau de volta.","1"
"mano e a maravilhosa do @nowunitedmusic dançando #yoyo ???? surtooooooo ","0"
"se vc usa whats e usa o status pfr apague o whats ","0"
"Filho de @SergioCabralRJ não tem condição moral de dar carteirada em ninguém https://t.co/wm8nqW1ksQ","1"
">>59361se com 3 anos já está assim, imagine então como será mais para frente. corra dessa merda, anão. talvez você se sinta incomodado no inicio, mas isso passa.","1"
"boa noite.descobri que minha namorada, quando estava com o ex-namorado há uns 2 anos atrás, estava em dúvida sobre o que ainda sentia por ele e se aproximou de um antigo cara que voltou a falar com ela que ela havia conhecido pela internet e que gostava antes de começar a namorar com o namorado, e mandou fotos dos pés pra ele quando ele pedia (ele tinha esse fetiche, obviamente). isso durou praticamente um mês, mandava apenas fotos dos pés e o pior que aconteceu foram fotos lambendo os pés. não chegou a mandar nudes, gemer no microfone e sequer conhecê-lo na vida real. ela disse que estava voltando a gostar dele e que achava que queria ter algo com ele. depois parece que ele deu um indício de que poderia contar pro namorado, ela disse tudo que tinha acontecido e parou de falar com ele. o namorado ficou chateado e perdoou porque eram só fotos dos pés.só que essa garota é completamente apaixonada por mim. nós namoramos antes disso tudo, durou menos de um ano porque ela era nova e a família descobriu que estávamos namorando pela internet e a obrigou a cortar relações comigo quando ficaram sabendo que eu havia viajado até a cidade dela para conhecê-la, porque ""eu poderia ser um estuprador"". ela perdeu o bv comigo, e depois disso voltamos a nos falar enquanto ela estava no fim do relacionamento com esse ex namorado e ela voltou a gostar de mim na mesma intensidade, e a ser minha melhor amiga. ela suportou uns 2 anos de foras meus porque eu não tinha certeza sobre meus sentimentos sobre ela e sentia que não gostava mais dela como antes, então ficava dizendo que não queria mais nada e que não em sentia igual sobre ela. ela ficou esses dois anos sem desistir de mim apesar disso. comecei até a namorar outra garota no lugar dela, e mesmo com tudo isso ela até engoliu a tristeza e me ajudou quando eu tive problemas com esse namoro, continuou firme e forte do meu lado esperando por mim e dizendo que ainda me amava, chegando ao cúmulo de escolher fazer faculdade na minha cidade (5h da cidade dela) só para que pudesse ficar perto de mim, mesmo comigo dizendo que não sabia se me apaixonaria por ela se ela estivesse aqui. e ela virá, no próximo mês vai se mudar pra minha cidade, mas agora eu sei que me sinto igual sobre ela e quero ficar com ela. ela é absolutamente obcecada por mim, parece até uma personagem de anime de tão caricato que é, é como se ela vivesse em função de mim e de me orbitar. eu sou 5/10, e ela é facilmente 8/10. é uma coisa tão maluca que eu nem sei o que a foda é, mas ninguém nunca me amou tanto assim. ela também é virgem, apesar do namorado. no caso dela eu acredito que seja verdade sim, já confirmei.ela mesma me contou toda essa história, disse que não queria ter mais segredo algum comigo antes de vir morar na minha cidade, mas estou com a cabeça cheia de fodas sobre essa história. o que vocês fariam?","1"
"aprendi da pior forma, mas aprendi.","0"
">>61875não, anão, estou lhe mostrando a única reação lógica de um homem inteligente sem mais recursos.vamos supor que você tenha nascido classe média, relativamente bem para o brasil, mas não o suficiente para ter chances razoáveis de conseguir o que seria ""uma boa esposa"" (sua família não era rica, se qi não está muito longe dos 100, você possui uma aparência mediana, etc…).o que você acha mais fácil, sequestrar uma piranha que tenha bons genes (tudo fica mais fácil sem ter que lidar para consentimento ou lealdade) ou competir com homens que nasceram superiores a você em tudo que importa?","1"
">>63491infelizmente não sou eu quem quero, anão. ela fala que eu sou ""abusivo"" e ""dominador"" e que ela quer ser livre. me sinto como um tolete boiando na água-mijo.","1"
"Tou a ver um filme de fufas aaaaa","1"
"@OdeCarvalho prefiro ser magra feia a ser gorda bonita. Mesmo se as gordas se arrumarem ñ adianta pela falta d elegancia do porte físico","1"
"O Facebook caiu justo agora que eu ia compartilhar aquela imagem pra doar 0,056442 centavos pra um coral de crianças mudas sem cabelo","1"
"quanto mais cheias as cadeias melhor galera!!!!!","1"
"ok eu to assim :o ","0"
"yge caindo aos poucos por causa dos escândalos e seus artistas sendo boicotados o tempo todo, blackpink recebendo todo o hate por fazer parte da empresa e elas só tem 13 músicas depois de 3 anos, privilégio pra vcs é isso?","0"
"- juntamente com alunos de educação física da pm de são paulo, convidei o governador a pagar 10 flexões. ","0"
"eu dando conselhos: ","0"
"A petição que pede a despenalização da #eutanásia foi aprovado por unanimidade, na comissão parlamentar. Vergonha! https://t.co/KqHPyQjizo","1"
">>61808é, teu relacionamento já acabou. primeiro, que tu jogou um pouco de dignidade que tinha ao trair ela, independente da mesma ser vadia ou não.agora, tu acha que ela não vai acabar sabendo uma hora ou outra? a garota que tu ficou, se aproximou dela justamente para ficar de joguinhos provocativos ou quem sabe até te chantagear, kek.mulheres são traiçoeiras, egoístas e vagabundas. tu acha mesmo que ambas se importam contigo? o que o >>62331 falou, está certo. nenhuma mulher aceita ficar com um homem que só quer sexo, a não ser que ela seja extremamente insegura. e pelo que tu relatou das conversas dela com outros homens, ela não é nada insegura. >>62332perdi.","1"
"tem é que privatizar as universidades mesmo só tem doutrinador marxista 
mas q eu queria uma vaguinha na ufrj queria.......","0"
">>28111é claro que o autor nunca teve experiência alguma com uma sociedade organizada por tribos.todos os pontos são massivamente incorretos quando posto numa sociedade tribal, principalmente numa que opera num confederacionismo ou/e que possui uma religião organizada.os dois últimos pontos, por exemplo, é absolutamente inexistente na relação dos taitoq com os rela na argélia, uma é composta por sangue puro, outra é miscigenada pra caralho; nunca houve um único conflito real entre ambos e eles só se odeiam porque muh política e porque vassalagem é um jogo de morder e assoprar.veja também a situação dos rechabitas, mesmo não sendo uma das doze, eram parte de israel, e nem assim se viam menor que israel, pois levavam com vigor suas tradições e não se dobravam aos costumes dos demais.eu sigo com a teoria da escola de viena, precisamente schmidt e koppers, que implica que todo conflito surge da aderência sutil de outros círculos culturais ou da expansão de uma apêndice ou civilização pivotal. bio-social é o meu pau no seu cu, a merda é puramente social, e é por razão de haver civilizações pivotais que embarcam projetos civilizacionais, que por serem como são, não são restritos e nem tomam parte de qualquer coisa de situação biológica.evolucionismo e racialismo é uma bosta que acaba por sempre foder ambos campos de estudo com bostações.","1"
"@ncevero @inxttulli @toperatopzera @ogatogalactico ahhh é assunto tbm kkkk","0"
"@GABRIELPlNHEIRO @RaquelRangel0 assiste a Serbian Film, se não vomitar passou no teste","0"
">>27247discordo completamente.historicamente todos os países europeus se desenvolveram a base do mercantilismo. até o fim da segunda guerra mundial, por exemplo, o governo britânico mantinha a maioria do setor de base. o crescimento econômico só pode existir nas costas de empresas privadas totalmente nacionais sancionadas pelo governo.os asiáticos fizeram isso bem no século 20.japão: toyota, sony, mitsubishi, panasonic…coréia: hyundai, samsung…todos esses países têm boa qualidade genética, eu entendo que o brasil nunca será como esses de cima mas olhe a bielorrússia ante a ucrânia. os dois países são idênticos sobre raça, religião e cultura, zero desculpas.a bielorússia investiu no mercado interno e nacional e a ucrânia vende batatas em troca de iphones e é chamada de nova khazaria pelos moedinhas oligarcas de lá.a ucrânia é o país europeu com o maior número de diplomas universitários por cabeça e tem o terreno absurdamente mais produtivo que a bielorrússia. mesmo assim o país nacionalista está muito melhor que os vendedores de batata que pedem empréstimos a bancos internacionais.toda venda feita por uma empresa multinacional é uma que uma empresa nacional deixou de fazer.","1"
"pensando na minha linda @neves_larissa","0"
"meus pêsames, aos famílias dessa tragédia. 😢😭 em transportadora salvador cargas ","0"
">>59010op da pergunta aqui. você teria mais algum conselho pra me dar em relação a esse assunto, de forma a minimizar ou até mesmo evitar possíveis problemas e aproveitar melhor a coisa toda?","1"
"olá, anões! sentem que lá vem relato!então, eu fiquei ansioso pra caralho a noite toda, eu fiquei imaginando que iria broxar devido o nervosismo e isso me deixava ainda pior. quando voltamos do rolê e fomos para o quarto dela, eu fiquei mais calmo, mas ainda parecia que meu coração ia sair pela boca. espero que ela não tenha percebido meu nervosismo.bem, deitamos na cama e eu comecei a beijá-la, fui descendo, dando beijos no pescoço, na barriga, chupei levemente seus peitos, massageando-a, etc. comecei a notar que a respiração dela tinha ficado mais ofegante, o que era um bom sinal. nesse momento, meu amiguinho já tinha começado a dar sinal de vida, eu ainda não estava duro, mas já senti que havia vida ali embaixo, pois ele já estava começando a ficar feliz. fui baixando até a boceta e coloquei em prática o que havia lido durante anos, de como fazer um bom oral. comecei dando beijinhos pela boceta toda e comecei a lamber suavemente o clitóris e lábios vaginais. inseri dois dedos na boceta dela, mas ela disse que não curtia. então voltei ao clitóris e ela tava cada vez mais ofegante, inclusive gemendo levemente (isso começou a me deixar atordoado pois não acreditava que tava vivendo aquilo, kek).nesse momento, tava chegando a hora da metelança e minha cabeça já começou a querer me sabotar de novo. comecei a imaginar que iria broxar na hora de colocar a camisinha, meu pau já estava duro, mas não o bastante, estava semi duro. comecei a me punhetar enquanto a chupava e aí ele ficou duro como pedra. essas preliminares duraram no máximo uns 10 minutos.enfim era chegado o momento. parei de  chupá-la, abri a camisinha e coloquei (nesse momento meu coração disparou novamente, e agora? onde e como enfiar, minha mente perguntava). como ela estava deitada na cama de frente para mim, eu abri um pouco as pernas dela qual ela abriu quando viu que eu ia meter, passei minha mão sob a buceta dela para ter a noção da entrada da vagina e fui enfiando de leve. enfim, finalmente, eu estava metendo! eu estava muito excitado, mas meu nervosismo era maior e acho que foi isso que evitou com que eu gozasse em pouco tempo (além da perda de sensibilidade com a camisinha). ficamos nessa posição de frango assado por uns minutos, mas eu cansei (fode não ser sedentário), então deitamos de lado e eu comecei a meter de ladinho, novamente passei a mão sob a vagina dela para me guiar e eu enfiar o garotão. ficamos nessa por bons minutos (comecei a achar algo até meio bizarro, já ficar só assim, mas aí tentei pensar em algo mais racional, como ""é assim na vida real, a vida real não é um pornô"") e eu tava imaginando que não ia conseguir gozar, até que pedi para ela ficar por cima e sentar. ah, meua migo… aí não teve jeito, em poucos minutos com ela cavalgando em mim, eu acabei gozando. finalmente, após 26 anos, finalmente eu transei.coisas que gostaria de relatar:>se eu já tivesse experiência, seria muito melhor, estaria menos nervoso, conseguiria aproveitar mais o momento e ter mais prazer>sexo é, sim, muito bom, apesar das minhas preocupações terem atrapalhado meu momento um pouco>teve momentos que achei que ia broxar, eu tava metendo e o pau às vezes parecia querer paumolecer, acho que era minhas neuras na cabeça>como ela tinha a mesma idade que eu, ela obviamente já teve muitas experiências anteriores e isso me deixava atordoado, era um iniciante com uma mulher que já manjava>apesar de tudo, eu consegui aparentar estar calmo e acho que fiz um bom trabalho, não acho que ela tenha notado que eu era virgem>já tive orgasmos muito melhores com a punheta, mas isso se deve porque eu estava muito nervoso durante o ato, mas o ato no geral, em si, é muito superior à punhetaapesar de agora já ter perdido a virgindade, ainda estou muito nervoso para a próxima vez kek. se for com ela de novo, será que é normal repetir o mesmo roteiro?also, foi melhor do que eu esperava, ao menos não batatei, não passei vergonha, não broxei e consegui durar até mais do que imaginava, uns 15 minutos + os 8~10 das preliminares, no total deve ter durado uns 21 minutos no total. eu ia cronometrar, mas com o nervosismo da hora nem o fiz.enfim, foi isso, perguntem o que quiserem.","1"
"- como vc imagina o paraíso?
- ","0"
"curtida e rt não é cu não meninos! podem dar a vontade não custa nada e nos ajuda muito, além de nos incentivar a postar cada vez mais coisas bacanas pra vcs! poxa custa nada começarem a curtir mais e dar mais rt! incentivo meninos  por favorzin rs 😘💕 ","0"
"«a beleza começa no momento que você decide ser você mesma» ✨
 salão de cabeleireiro mundo das crespas 💆🏽‍♀️💇🏾‍♀️
i'm my own boss ✊🏾🤘🏾 ","0"
"é que voce me faz bem","0"
"@_Nabarra 'Estimo que se foda' será mais profissional.","1"
"@chaomendespg nossa chão eu já tava chorando aqui","0"
"Que bonito hein! Que cena mais linda, será que eu posso participar com o casalzinho ae? https://t.co/KWvi9EFkBL","0"
"@nemsequertentes pffff, vai jogar 8 ball poll e não me chateis ahaha","0"
"autonomia legislativa e financeira para cada município. estados e a união resolvem disputas, um valor seria repassado para a união manter o exército (que aposto que seria melhor gasto entregue ao país que não deve ser nomeado para nossa defesa, o valor gasto seria menor e teríamos mais poder em caso de uma guerra). não gostou das leis do seu município? a competição legislativa e tributária logo pressionaria os municípios a caminharem sentido a liberdade econômica e social, além de progressivamente eliminar impostos sobre a produção e concentrar os impostos sobre a renda, que é o resultado ótimo.","1"
